{
  "$schema": "https://json-schema.org/draft/2020-12/schema",
  "$id": "urn:codeattest:protocol:v0:signing-key-directory",
  "title": "Signing Key Directory",
  "type": "object",
  "additionalProperties": false,
  "required": [
    "protocol_version",
    "directory_version",
    "trust_anchor_key_id",
    "published_at",
    "keys",
    "directory_signature"
  ],
  "properties": {
    "protocol_version": {
      "$ref": "urn:codeattest:protocol:v0:shared-definitions#/$defs/protocol_version"
    },
    "directory_version": {
      "type": "integer",
      "minimum": 1,
      "maximum": 9007199254740991
    },
    "trust_anchor_key_id": {
      "$ref": "urn:codeattest:protocol:v0:shared-definitions#/$defs/non_empty_string"
    },
    "published_at": {
      "$ref": "urn:codeattest:protocol:v0:shared-definitions#/$defs/utc_rfc3339_timestamp"
    },
    "keys": {
      "type": "array",
      "minItems": 1,
      "maxItems": 1000,
      "items": {
        "$ref": "urn:codeattest:protocol:v0:signing-key-record"
      }
    },
    "directory_signature": {
      "$ref": "urn:codeattest:protocol:v0:signature-envelope"
    }
  }
}
