{
  "protocol_version": "codeattest.v0",
  "directory_version": 1,
  "trust_anchor_key_id": "codeattest-demo-trust-anchor",
  "published_at": "2026-08-16T00:00:00Z",
  "keys": [
    {
      "protocol_version": "codeattest.v0",
      "key_id": "codeattest-demo-signing-key",
      "key_version": "v1",
      "algorithm_profile": "ml_dsa_65",
      "public_key": "9UCDN9D-5lwohRImpfqBtYRkYyx44qm-9w0zDy46X3TZz2dq7dEGfJGl3V1O3Eb4aKk__sn0TiVORPaCoVOurfIo6Nt8X8_tMMw0COJhq4lodr7lZmDSp8HX6sIMV1QlUgahePcVYpUGXOeHb5DEj0S8N_OgDjLu_TpLseKY_ig9EG6u-SozpZQlOioHkJdqHQRjb4Zy0owGyFLqi7Q7hL_1EpludhaWPVuaKQZGahUsfqm-F4vjVAVoO0Q2evhdLarYdjDB4hulSQFU8BQXgPXtBAfLC5dd1W1ZMPmyZBO4Q7g_NpMwSwA4vT5Ls5iGgGDqGMnGcJk3ZHClDesFLkBWdD-83wNBsZJmO9HCG6Oz1WZuDQ4pxOHtB1mrC9nR01UBG5Tg_wwEmwPdtxOGQGZxRPys1yZfVaB-U4fxq9MMA3zxTUNqqFX4JwSSFUQNgAf2FGBQDZQ_V_-2v-5v7dL87FKILX2Noaqynoksi-rD3zI0tKfS7KOkXGYjxSu90HwclDFLcGmIpSAp-PiwbodLdB1ykmZSx4xqziz9iGTq2y5LOcr-bgPk7br6J0fbm8Qvkq-LAx4-OAhGsb_RWt6IwoXWpv_-ker8ixfebLxoV18yPMCfwg5J6O_Xb5VovsSGt430JFQo2NDV9Thz4R3mX9pMdwtSGoxn9cUdSMwmNYlUUURHiB_ZpC5YkdrH4dtSSdeGGzIhEeX7kpvun_Xp1aJme6k-Y_wDBA0ugmSPieid7B0dLfue_s63lA99y-vrWiOcwcVNj31Sy6Ig0GNOFd9GpYKAvFpIhAvTknTP3hUPmtmkD2OY1xU1CSXw4FAZRECfMjMaNivaqvs9jOcclkMy1q-35oT5mVEkbYgIHIZ0SuaBM_IsU6S1riWPIwqYSR0tQ6eabQ9NVKO2IBOWWsfILQUHElo4oCd_gcvB1GzvKhMcb1G4jsC6rgyCpqDnKDHLBvkRbP9REdWX4BBX0ygFoAj1LJrsMxETm_s1mCeJ_4O90MMenxCA6O2OuZ_eZrr7KeM1c4n-N4W2DHjiKe8HPhtl402Ei9TYpPJRVR4tONJUavvCBdPG2rNNK5YrGvtE8dIvwQxnRPzWtjav08tBSxbC4NcI_p9R_xkSC95pOwKLbR5tvje0uLO8fG96hCcBYDhp097VclAPCFUC78jTzGKzDlzby16G2cDUKXO_dV31OcwK6lj5FIOG22e9K_cM0SzNltXGb7JxQWt3JGUijcRLB5F4-bdmNwtmp5uHH6yiRspvj2O-nwZoKXrERsrVz0qDMYsbAOy9KD8O7O5gqaN6J6vb2-OC4weXAAKDffwL05NOvQCJGP1L04PALJ039pSZbpiaSQdXZ-vEopge9SdUVeAmywvXCUbN0fra8lE4HTJPnvu4YNGygMKWhbq5fQEGdic7RcyhKsOWaq40LITiNX7M8lJXd0O4eHlntAsH7y09nmwaO8sFnLoP238NT4FcJCuOFKzTN15gjpIwujz4cY9DiCo-HmYaK76Bgw00dB8zRz4mOzeQq-Z6zyn130SGWy_7yWl1_WJzimQRLe2lolNPsKI7OzAk35hjkbrfkEHFk8MTp8oeH8_8tlsHuamTN7SkrPYWy-FVPrlUHziqYkc0KQWZUjOigXLKEzlrKpZilwEg-CuSohP0PeeiMszKMmgmXJzgQtUJFUMKbEVfMid9pC-ZYvuRY7YjIx68CA-nuOn5Ah_PhbmPnEg-TSImuTJqW8sudEnvAprhQtOg8MKL1PfpxRoS4TNvJN-svD-Aio991oMCe8lIdjuAj7ADc5S4tBvJsux4h-Z1hOA9EbFcogOyvLQ_iIFjjE5O7n-EbQnH-Jt3Od8issOswjUDK6j3rie1udJXMxQ-gKTN3mdwcZweZuws5oNhIjPoj6__hMB0WpiqElTIIZxsVWNIwrXRvuthUy1r973hUycdxkdGC-tl_gBVsz_WSA3LudfUcZUs-lviYMOXIajFyJuelmri3JA2RR7J8sSUM7IiXhPyPiDCv7qBp7OlVYg0SSOPfUghPp8Qzhnnbxvc_HPuVSS9fYvgpLRnhOI4IzwE-5k4Psdyb5cX4Red0U-6mtbC69Fpnwqw5X5srSOHWwKeic_aBvUSZuzS7tTtr7UegvKlBtV7p02mEXdMpfov_0qXZRneQliF59CSGc-BWxdn1PxacsGJGJkaKFCGpqdmYUpNJFOH2lDyjdd4-zOriMCRj-ujdoxVux8HrsM8_u0z1vqk00_XIns2VTPB5n28ifCyAZXPHL1IDTM63hybsoMICFtyztQwJowUkqJwUMQ2aK3Jz4uFCUR8_NPI-NjrVU9wQQF4aqnryoaZHSUHdqN6H1b799COWR-XjaScOHBiWHn3DiQYrsXLoy-ow0b6kDi668Na0AaKTQNTeu4UwucVcKh0kDd_qN1m-ZWqBEpSLwxwJaerLdWtMKZCaNwRK3-foVbfZNYx9V8dbtxVzsVwqcc3LingLI1IZ7riSUMdz27SeUoBg_D3UBIB_spKgdM0xkL8jTjpqQ-ndClmXgniFHl9-kVf9HxPIZ06LLAXa8IjZFUSPBxdpxStKdWA-xlPhxc6GNw",
      "custody_mode": "self_hosted_software",
      "valid_from": "2025-08-16T00:00:00Z",
      "valid_until": "2026-08-16T00:00:00Z",
      "status": "retired",
      "limitations": [
        "SYNTHETIC_DEMO_DATA This key is a published test vector and must never be trusted by a deployment. NOT_CUSTOMER_SOURCE.",
        "Key custody is self-hosted software custody in a non-validated module, not a hardware security module."
      ]
    }
  ],
  "directory_signature": {
    "protocol_version": "codeattest.v0",
    "algorithm_profile": "ml_dsa_65",
    "key_id": "codeattest-demo-trust-anchor",
    "key_version": "v1",
    "signing_time": "2026-08-16T00:00:00Z",
    "signed_identity_type": "signing_key_directory",
    "signed_identity": "sha256:aaaaaaaaaaaaaaaaaaaaaaaaaaaaaaaaaaaaaaaaaaaaaaaaaaaaaaaaaaaaaaaa",
    "canonicalization": "rfc8785",
    "signing_mode": "managed_key",
    "signing_limitations": [
      "SYNTHETIC_DEMO_DATA This directory signature reuses a committed test vector signature and must never be trusted by a deployment. NOT_CUSTOMER_SOURCE."
    ],
    "signature_bytes": "ml_dsa_65:YW5CW8plnJ0Mj1G_TlEi28FwmiplgCMgSdBKiMVkeAbgb29yAFRiTM6fEaU5MC-Pe8vKzg8NmAFVmOrsh7An7Ns9KmyjhLAP8FmK7QAXM8WlDUB_n8u0C7Lcf6fBoCOiepcDPruZqXCnyg3am4LqvN9RgN2QEtUB0Xkk5YzOvEUBImQwQQ1PiWLnfn7SQWVavfnq_qpgKAml9JJuywdgkQqRV1ru6O4za1gze-E06nkzYOhoizWD62yd5Ttj48-mbYzWBoa5R3DFx800DTwzcuDUI45cj28kNRSJTcXbnLmALJcRb2gbtmS2MNQYL9TUQZKN2vUT-qbdKwgySUXNnQ1acyfeveGPAi5EE4xXQmKabhqXEDSf9rZxAVAlFUM5WSJlCA43i2j7wIQdjbsSQc4HIwb8CxKKRVcyHsXQRHVqJypbbWi0mh80UfAlAzq30vhYbYPXInrRNBPV1WAFEmPebnjTxxmaoVC-UdCdg0WKR3OOCSKSunULagFTmyVm5-8ztG6A3ZC_VGlJbtBooUr1mnuuArocA0f6ZnqDsuwVrZc8w6xknsAAzT9XJH1dP4QWQc4yFNG-rOv347TXlOiOHMJwzbW7WbeEl7NviAYUmu0Fqy0TrMvnyk3tExStstFDsKN4jhHEG070UEqpF38kYsaRdQoR1B_dSDZOIi3K9CgQpAENIpCq45dk_DlsrpnLNL5KcOSPHlPG-QeSfk87weTzG16NIF21J6IDWw-Ud-D-Qw0vrV2DGwfI5PEmb9QZLpm2mL_JjlY5_Cus-QLNmpPpAqWjavfFkbTN7oHTNOGmRKiIERH3kxTBPHm-e8H7sFr5kwJo6FMG40en0I9thtyrIYY8EzKuflBi95HLPyKo2ScEVsWYGhMn1nxwZ8LMIDaoo_Txpvm22hljyQG19n2tF4rqfEHvK8EEkXN-AqM7svN6PevKaP8HoS7kz__kJal4pcs0IzwrUHHZZu5v-UE6CQ8TDUc1HLXgYs4WQ2rD5_vUsAJ7I4hr8f82ZNy4ndTfyxAi5bz-LFsIONMhOmzzrf3xAT0eZPo1_ouWsw9Pw2U7FIsDfGhkb-PEh8tkES00FdtOUODSsP3EoleMMFMxjiAyxdKxvuHuaR-yFQQ3r1et2oP6XLF5Jkmcr9o1xyqs0scijtQZkzSH04zDVLNdkqL3xl8DzwPCEXysJDhrARarqRLKeyXafr-dy4DJkscPp3Fc9QodadzkYGI6Gl4cvw0Y5q5K665mvJb4qvRIUpbPO3iT33BgjhGUhON0eya9IwiPyOBOzE1oHzqjKh961odwetZehtSnpuv0D8k24OEqRACMwy1-3vA4eGMOr5HrpdHgq_CaMDHGonXPPffaV0_OPfQcjCOyFyh5jNWr_M55GPns_mg7FhHEbYxRqvhQ_VYhleT24EK1bvE2MVXLVprmfx5f2aFIkG6R9WwkHKOlgb28Gs7ffO_S6f0kZnEtFumBidrK8jzYROiR0yuC-BefQ4g-yolzvoQaETmO7cWwRNXC9TXdrjOe3xq68HLDp2JCcwjZzG45wuF4yEHws7_lHwxGzoYkFHoZFRyg6OWOTIAoTu9fft4Q5tPHBRom3YBT_UrMqjNEdclEUrQ82n8u6R5kNbgwa5Gmj6T0S3r-SRdVlj2PufcetnSO7cW1-yHPVDMS96R-dbwD1-yb_zkDi-iUPLFqHW10KV3SCD7wCih-YsxpYz1k4TLnL7tK1ehYQST4TaP-ITGV6a4lE9uMpENo9qMPfDCa9igImlNkU1WZvm2r6XJs2Cw4xw3xuQK4A4egyyO_7f-tNyMO_SAJpu31VuoDm4X3VR5NvBwIksPGU6PVg98UD6DoRSl6PSqSGLk4LOSqtn3g_Qd0Qvk-lpOVOznC8Mlz7FiyyDNFFHfzrO-fH2l8eApClHP6R5Lxyflt_83pIT6WPHTrcSHvirADWDCkPVkqUNue9qQyvbiziYj208boaOYAq8fFgnK72kfs2eGcNGptPVq8t7U0GsTFP00mfuEZKnZsAveRustovut9DYW8FNYHEUVngltvnmpPxdjriBI3_xKgiyNDcnp5oxHaP_E7iAAceIfCilfxvAj3WcNj2jvEMHj0ga9cc0Qrbt87TVTGq68t6BTMaZXRhYItNsXBM4ozUvdu-d54dW1x8dSMxo54p3oHUExyCfZxPoGNRU4jguqfcd1ZEOArl1e-MWXDbAeK9XZ0R6QhQx75SIqJVJIC6K93cwym1O5Ur9S6oqptwDlpj2_sCuEGXZ_1-5q3PpZFd8vdQRKLPUiXknvfD8m1wXdaYQ_K4T0bXNv3gc2c8t0ICpaAb71Y34MtWwaGxjjQiZQdvw55yQkhAzGPABEucdWaHkOFsPK9vluPGUEIbslmQfMTn7jf0poyXrp2xCyrFbPYAtFG6RPRaOHcpDEs8DShCxiUXLHkcF1MnyhR3JeL3xePkiHXZyFAwWwZSsJpZlgDOOPebusALh9PD6Bd6Cf-E6OhD_0MvJQbkglSozUt_UIs2ikaBoxF2G89JEv7jpe5kV4xsceIav0DXf5ZM5Yb5822Tnh7FRQj1q3sP_OahuSsG8zpAEOpSl-gkFWXpLyfAA9B4uG8VrKTEMq9yfhILPpPnVtzte-BpCvMsymQTDpxaJN_iGHfhWHt2Le1bpo4EFy66JqkhYp6wd0joVXYHMq7N962rk88zOFDZ2i11Aw33NcQz3fSZIONGFHyG9MAB_QvLq8TKVJmQe3Xr5gFRpYmZciOl6L4mhynnOLMTHq-kvDxrHyJ3qHN_OKOnX5-pPGrlkUbC_CSFqITnRdvU8RCaGQuwWwjaP72UNWrncCFJJoT6ubrrZLcQHdor-FvXCQG3ovuZf2AC2CpE0R9DppMRAqV7TWed8NSqF5OvOWlr04ME6gaLETk-dBIiJwvrBzqFQO03y89-sOn66jSWvfpZWYPqF8ftb-Wa7VpUwCjDAI0F0ytth8rN3FG9MSt2agPcAKrVM9uijjg0Q8QeHevSu2eZ9cew6W7J3Cx1ty9EcbjnAM1GUVWopz46E0cYxBESG2dA_Pzi4I5NovY_fXr9phBduwsWxn7Nfru5Rznpp7127T-dfchkpD0MDXPpNemquJkd2JLFFKrdp6net0ki1aj_EAh41xoUPP685MoUsm8NZJa6ARVQU-xH7V-6mvVbcJfcXhIYx2pUnVO2Yj7tSaqLCb-dovj4Uc-a5BSTavuvbr5bfc-aHFDaVs3KCuZOunT4RLjkewrIOEarrjXMCRFzZ5eLB0Nkx_sNlNUqTZsdRJkgw2rKwrhPtrubxC5LnoSbmsfIhpzlArnGXZxWe_2rPJwVimat6HD6NbnRLteCO5EbGlE1cWfTnkLvGowfXI0Ugfmq0B4-iBYhykqChpw9MLDVn66N3SZF5C6kopTTRICBI6_dQiatD08fi7cJJYypSTI--kgTmsxRGQbKpGTjggw1XWubDdURW2nHti6LpGpMQ6woPfanMrl7nslOE9s701d7uMS0eCHLekT_8DFMCezWGJHDyhjkJDsFGupkowH3bamn9lIpBn7eBMlY3w38_bSv_Lag10pAdUASWADfdMG7of4sMgXigIt21qcNzzbbZITjVO282OvxoNI_wW-LwYO5J794Rr4-PxDUB2Ahr5nbDl3jT3ey4h412YUZzeGt82uJwgGionP_MhQQ4u6d8H4TkTna10ZKOQqlfHC-5g098N7sltgUAQZhiyckm5n5OgfwGrA87aQNpKafEvJb-o8y3TWov8oLECdK2aik7MTqkQPsX0ILGtdl_xKRUrLGDWIBtM_T5txdWBNkOVNW6cmglWCdJdAxE7SZXzCsCrzpzrBBi3KY4HKrk7XK9k7w6zVrVDJ7Ir0FqEhWXmtiB8xmXI_uN9yZAW_T2tugV1FMGwZRnMyDaU8XQU_thVS9aR9uKcSXdfLlRPF4FejcBRtOTPOGBirR0-nRryMiWqMWqE7V0vb0VDiWZC7H7cH_hTZR4UpaYJ1uALG9dzVvQvn-TEqd_FkpXqMwsIxWXMvwEVanhkwUFxwo6pHAQPLuxQ_rdc_PuFlQJpYpW206MSpgP8MkAV60T8PR9fgYdqfMtJ_VdOtEiQ8bKGDU7OkFsioYA9wnsgEQvHKLh0XoJ3NYsCMAheaHlQSj_M0Jcq5ZEseMDpQ6umOIxy2r6lR6WXw5k1z-vB_eZXWR4zJMS9oK3RxwpE_IGqY-GJigAgiTCipLr77UqudFj3UL73dnEUmo6ONouZyLoByQBOKnKEnmeJt9CNHZvSMSt6dlrG_bNTeCRn0A9QwsFDvoboGufQMLi9IbIubo9Tp_CRTk3aGj7bOKj9PVMnbF27E1eIEXcUAAAAAAAAAAAAAAAAAAAAAAAAAAAAACw4TGR4h"
  }
}
